note_id,comment_id,create_time,ip_location_y,content,user_id_y,nickname_y,sub_comment_count,like_count_y,processed,label_h
6788500c000000001b0096fd,6789229000000000220057c8,2025/1/16 15:15,上海,"cute,cute,very good",62e3455b00000000190226a1,你的老煤 ??,349,0,cute cute good,
67856337000000000203f7d5,67892299000000002200f08d,2025/1/16 0:00,其他,Your cat is really cool,601cdc7f00000000010065fc,老大叔,0,1648,cat cool,
67890d57000000001602144d,67892462000000002200daed,2025/1/16 15:24,越南,bro don't make us look weird they gonna kick us outb,6786695f000000000803c9f7,helloMeUSA,42,0,bro make look weird gon kick outb,
67878c980000000016031cee,67892490000000001b02d737,2025/1/16 15:06,其他,beautiful,62ad4726000000001b02b59b,zz,2,3,beautiful,
6785e86b000000000b030a68,67892b09000000002101f6c7,2025/1/16 0:00,其他,Zayne lover here zayne 爱好者在这里,67863673000000000803f3f8,Maryzhearts,1,1,zayne lover zayne,
678739f90000000016023c72,67892ddc000000001b03e43e,2025/1/16 16:03,美国,Ok gang,6787c9f7000000000801d590,小红薯67889C7D,19,0,ok gang,
678917430000000019031828,67892e18000000002200fc88,2025/1/17 0:00,其他,"hi beauty！You look like a star, but I forget the name",66728cfa0000000003030ce7,hanhan要早睡早起,0,6774,hi beauty look star forget name,
67875fc80000000021002f14,67893071000000002102f3ed,2025/1/17 0:00,美国,Hand over my Chinese name sis ,678610fd000000000803ee5d,Riri??,3,14,hand chinese name sis,
67888c360000000019006a52,67893243000000002101d011,2025/1/16 15:06,其他,"if you don't trust americans, message me, i'm australian ??",6785f51c000000000801e2a8,瓦伦丁,354,0,trust americans message australian,
67873c180000000021003e2d,6789334a000000002200095c,2025/1/16 15:06,美国,Thank you so much for your kindness and love. I'm so excited to be able to make friends from China. It looks so gorgeous there.,67866cb6000000000801e5a6,Michelle Daigle,1,1,much kindness love excited able make friends china looks gorgeous,
678614f60000000001000d20,67893437000000001b03055a,2025/1/17 0:00,其他,My  dog,5c20b0740000000006023818,: ),0,1,dog,
6788d12500000000190125d2,6789360a000000002200f14b,2025/1/16 16:38,英国,"Yes he is, I know him.Sunshine rainbow white pony",5bfa60232522590001ed155a,TK refugee,528,45,yes know sunshine rainbow white pony,
6788aaf600000000160236c2,67893614000000001b03dce1,2025/1/16 17:53,其他,OMG WHY IS SHE HERE GET TF OFF GO BACK TO TT,67866896000000000803f283,イアン,23,5118,omg get tf go tt,
678794e4000000001601a50b,678938d400000000220008b0,2025/1/17 0:00,美国,Any fellow refugee here?,678931d7000000000d008cd6,Akira,2,6066,fellow refugee,
6788c50f0000000017001223,678939320000000022008eab,2025/1/16 16:52,美国,"Hi Amy!! I've been following you for years on YouTube, I'm so happy I found you here! ",67855c68000000000803c411,Yoss?,10,796,hi following years happy found,
678937e00000000003021f58,67893ada00000000220069c4,2025/1/16 16:59,四川,"洋相 in Chinese means doing someone stupid or funny, and 洋人 means foreigner.",62172c01000000001000c484,下了猫猫雨,49,2939,chinese means someone stupid funny means foreigner,
6788dd47000000001803e4ee,67893c54000000002102f78d,2025/1/16 17:05,北京,"Good morning new friends! How are you? I'm fine thank you, and you?",6183ca0f000000001000d0d0,探探野生版,70,2615,good morning new friends fine thank,
678917430000000019031828,67893dec000000002200e673,2025/1/17 0:00,其他,lamo,65ec1a37000000000500cb21,小红薯65EC742F,0,0,lamo,
6788c7d3000000001b00818d,67893f64000000002200a857,2025/1/17 0:00,其他,hi，it's me,5f77203e00000000010022c1,橙C,3,12,hi,
6785e86b000000000b030a68,67893f6c000000001b03aed9,2025/1/17 0:00,美国,Henlo I have arrived ,67853703000000000801f3f1,Skyexy,2,22,henlo arrived,
6788c64b000000001801d328,67893fbb000000002102c647,2025/1/16 17:53,美国,Thank you for bringing this up! Changing my wording from now on!,678701310000000008019e8a,Rachael,2,2497,thank bringing changing wording,
678496ea000000001a0107b6,67893fdf0000000021031278,2025/1/16 17:20,四川,Hi,5bb4e7319cb8ac000179949f,yuan.ho,162,1129,hi,
678563e3000000000800df5b,678943ce000000002102e070,2025/1/16 17:53,其他,hi,5c3f6c18000000000602d633,蛤？,2,4,hi,
6788e9d8000000001801e5d3,67894913000000002200346c,2025/1/16 17:53,美国,The cat looks very clever,61d3b668000000001000b07c,～YAMI～,2,25,cat looks clever,
678637160000000017038aba,67894b200000000022000f26,2025/1/16 17:53,美国,my cat  tax,6787f814000000000801db67,Altaf Jawadi,2,53,cat tax,
67890d57000000001602144d,67894bb6000000001b03d186,2025/1/16 18:11,美国,Brick by brick... it's working,66d52027000000001d031ac7,Sam Hudman 浩天,1,0,brick brick working,
67879239000000001901965c,67894bfb000000001b01d258,2025/1/16 17:53,其他,My pussy throbbing hard rn ,6785bafe000000000803d799,小红薯678679A3,1,6,pussy throbbing hard rn,
678887ed000000001901c29b,67894eab000000002200ba75,2025/1/16 18:24,文莱,,670b483b000000001d0223bd,小红薯670BADE9,165,3,,
6788a12d000000001802dd82,67895288000000002200512a,2025/1/16 18:40,美国,this is not paul george lmao how are you all falling for this,67892c2d000000000a03c543,imgaysike,68,9,paul george lmao falling,
6786cbe6000000000203d89e,6789536e000000001b03f721,2025/1/16 17:53,美国,The foreign Sylus girlies are called "洋狸" here on this platform which translates to Foreign Kitten or Western Kitten ,5caf73260000000017024047,momo,0,559,foreign sylus girlies called platform translates foreign kitten western kitten,
6788c64b000000001801d328,6789564f000000002101e420,2025/1/16 17:53,美国,We in USA can be extremely sarcastic ???? it isn't meant to offend,6785419a000000000803c35c,Jessicasinke,14,0,usa sarcastic meant offend,
67893e08000000001d01012f,67895791000000002101a8c5,2025/1/16 17:53,其他,"Hi, can you call my name? My name is laopo",66c9e989000000001d0219af,临momo,4,1109,hi call name name laopo,
6786bae90000000019034df3,6789586700000000210322e8,2025/1/16 17:53,美国,"you deserve a break, have a nice vacation Mr. spy!",67894974000000000a03d828,itssam_,1,340,deserve break nice vacation mr spy,
678958a60000000019019224,678959850000000022003243,2025/1/16 17:53,美国,can we start a study group or something,67895345000000000a03f4f7,avastoner,188,66,start study group something,
6786be5d000000000b00f29c,678959d80000000022003b24,2025/1/16 17:53,其他,"we call him C luo, cos there were many Ronaldo playing football",5ab5d12811be1002e125bffd,大玩,0,4,call luo cos many ronaldo playing football,
6786ba5e000000002002d18b,678960a1000000002103cdd4,2025/1/17 0:00,其他,If my spy can do her eyeliner like you... she can have all the data she wants.,67884e29000000000801c40f,Gingersnap 姜饼,6,1005,spy eyeliner data wants,
67852f830000000020016f1d,678961ed000000001a03a4d6,2025/1/16 20:40,美国,How do I save videos here,67887ec7000000000803c6fb,Delores O??,2,3092,save videos,
678958a60000000019019224,6789628b0000000022000c04,2025/1/16 20:40,其他,"As a native of China, i have no idea too ??（No offense）",60471f4f0000000001009b5b,興 John,75,456,native china idea offense,
678958a60000000019019224,6789634c000000002200bca7,2025/1/16 20:40,美国,You are the prettiest American girl I have ever seen ,624e978a000000001000e8ed,Lucas Jin,15,1,prettiest american girl seen,
6786e6e50000000018017514,6789686b000000001a00d94f,2025/1/17 0:00,美国,"I found you, sis ??",67841f66000000000801f8a2,DaliaSanta??,1,0,found sis,
67890d57000000001602144d,67896b450000000021019d9d,2025/1/16 20:25,河北,I want to make a foreign friend.,6479c9a7000000001c029be2,Itachi Uchiha,19,1166,want make foreign friend,
678754c4000000001b00b272,67897098000000001b03d543,2025/1/17 0:00,其他,,5a30c7cbe8ac2b5a256cd2c3,麦兜爱咪猪包,0,7,,
6786189c000000000100a0c1,6789735d000000001b02d8cb,2025/1/17 0:00,美国,Refugee from Louisiana my friend,67896dc7000000000e01f7d8,Babs06,1,0,refugee louisiana friend,
67886b3f000000001d0112de,678974a8000000002101a326,2025/1/16 21:05,德国,What a lovely story! I’ve already followed you and look forward to hearing more about your future stories with him!,5ce10a8c0000000012035661,橙子,17,588,story followed look hearing future stories,
6788c50f0000000017001223,67897c240000000022005fe0,2025/1/16 21:37,美国,"Trust her, she tried everything, much more than most Chinese ",5ee99ed80000000001000247,momo,80,2,trust tried everything chinese,
6788c64b000000001801d328,67897f0400000000220053d0,2025/1/16 20:40,美国,"With all due respect, it's you guys that started calling us that first and we just sort of went with it.",6784c11f000000000801b8d8,SagePhantomhive,37,26,due respect guys started calling first sort went,
67890d57000000001602144d,67897f8700000000210359bc,2025/1/16 21:52,美国,they're gonna think we're crazy dawg stop ts madness,673520b4000000001c01ac33,baph,17,2,gon think crazy dawg stop ts madness,
678858fd0000000018016b57,678982e7000000002003b7e2,2025/1/16 22:06,美国,Alternative payment!,678861ff00000000080196b2,Adrik,58,2204,alternative payment,
6787a43c000000001d010baf,678988180000000022000ce2,2025/1/16 23:26,美国,How so we get the English and Chinese subtitles in this app? I want to be accessible and I'm not sure how,6784100f000000000801fefe,Cunniff Creations,4,1023,get english chinese subtitles app want accessible sure,
6788c50f0000000017001223,678988a100000000220018be,2025/1/16 22:30,美国,hi amy. how hard/easy is it for a vegetarian/vegan over in china?,678535a3000000000803eb70,erikpreston,114,1,hi hard easy vegetarian vegan china,
67852ed8000000002002e5de,678989170000000021015595,2025/1/17 0:00,其他,wife,5cc93775000000001700eaff,忧郁螺蛳粉,2,0,wife,
6789771d00000000160220e5,678989f5000000001b01f98a,2025/1/16 22:36,美国,Look I was barely a 5 in the US now I'm 0,67857948000000000803e53a,KittyChaos,37,6,look,
6789844d00000000160184f2,67898b96000000002200e912,2025/1/17 0:00,其他,Exports have been transferred to domestic sales.,62455f780000000010007242,立德树人悦悦老师,2,619,exports transferred domestic sales,
6785d56c000000001a035741,67898cf0000000002200a6f2,2025/1/17 0:00,其他,Hi I'm kat from america! <3,678724c7000000000803e8db,Māo (猫),4,219,hi kat america,
67880167000000001801d837,678994ef000000002101d086,2025/1/17 0:00,美国,I love it here too. I hope we aren't ruining it for them though. 我也喜欢这里。但我希望我们没有毁了他们的兴致,678710ca000000000801dafb,Sue Madonna,45,1,hope ruining,
6788dbc4000000001900640f,6789962300000000220038b0,2025/1/17 0:00,其他,PLEASE MAKE THIS POST VIRAL请让这个帖子火起来,5cfd180d000000000601d1cd,咖萌 Kamon Yō,0,16,please make post viral,
678738a4000000001801f08b,67899c37000000001b02c894,2025/1/16 23:26,美国,Is it possible to translate automatically the comments to English? We do not understand the Chinese alphabet,6788c2c2000000000803d5fd,Jean Battista,1,5,possible translate comments english understand chinese alphabet,
67897127000000001d012958,67899c5a000000002103dd52,2025/1/16 23:55,美国,Please translate for people on this app,674bad3d000000001d02de7f,Nikk,100,3,please translate people app,
6787d05e0000000019005f6e,6789a105000000001b034460,2025/1/16 23:26,其他,Uhhhh,67856f58000000000801a1cc,屎怪666,10,0,uhhhh,
67882fb200000000160218ad,6789a225000000001b03873a,2025/1/17 0:00,美国,Outfit is fire,669854f0000000000f03717f,Ximena Mancera,0,71,outfit fire,
67868923000000000b036949,6789a36f0000000021037044,2025/1/16 23:26,其他,I'd like to be friends :),67886cd8000000000801a6e2,ArsonArachnid,1,6,friends,
6789645b000000001901ca31,6789a447000000002200e50e,2025/1/16 23:26,其他,Why are people so handsome/pretty here? I feel like a old bag ,6784d1c50000000008018685,用户已注销,3,1005,people handsome feel old bag,
6788dbc4000000001900640f,6789a4870000000022007330,2025/1/17 0:00,其他,,635904f6000000001802f6c5,蛇??,0,1,,
67868174000000000203d705,6789a5a8000000002101ca79,2025/1/17 0:00,其他,moots,6786cbeb000000000803d97d,lei??,1,32,moots,
6789645b000000001901ca31,6789a688000000002200caee,2025/1/16 23:26,其他,Thank you for welcoming me in your life,6785ad7e000000000803cad2,小红薯6787285B,6,1,thank welcoming life,
678794e4000000001601a50b,6789a879000000001a0382b8,2025/1/17 0:00,美国,What about when I comment? I would love to have mine with additional translation to the side when I do like how others have it,67844464000000000801b477,Eyyhans,3,8,comment love mine additional translation side others,
6786c39e000000000b02369b,6789a91c000000001b036cfb,2025/1/17 0:00,美国,"We are villagers of the earth village. Sure, welcome to  join us.",6788ed90000000000801f662,WolfAlone,1,1,villagers earth village sure welcome join,
678720440000000016022613,6789ab7c000000001b02c959,2025/1/17 0:59,美国,remember to put Chinese subtitles,674b398b000000001d02ea7e,天使,18,17,remember put chinese subtitles,
67854dcc000000001703a617,6789b100000000002102c5b7,2025/1/17 0:00,其他,help me,624da5f70000000010009d05,namna,9,1,help,
6789844d00000000160184f2,6789b285000000002103dc70,2025/1/17 0:00,其他,Hahah hewo ,5aeeed12e8ac2b70df1f8667,itsAirii,1,381,hahah hewo,
6786eeac0000000019030791,6789b2a4000000001b02cddb,2025/1/17 2:13,美国,hello，Can I be your friend? I am Li.,62efc98a000000001f0048ab,Rorschach,0,0,hello friend li,
6787d3df0000000018030988,6789b71d000000002200f577,2025/1/17 0:00,其他,Hello!,67895c41000000000d00bfc2,cohenn,2,0,hello,
678694cf00000000190358f6,6789b8e7000000002200b358,2025/1/17 2:13,其他,,67849f99000000000803e50d,Mad Hatter,5,146,,
6789771d00000000160220e5,6789b9290000000020039a5c,2025/1/17 1:58,特立尼达和多巴哥,Moots anyone ,67854ff900000000080185fc,Kiki,53,14,moots anyone,
678917430000000019031828,6789b9ce0000000022004f9e,2025/1/17 0:00,其他,You look very beautiful. Nice to meet you.  Can we follow each other?,678607c5000000000803eb20,小红薯678E44BC,0,2358,look beautiful nice meet follow,
6788826c00000000190320c2,6789bb53000000002200e5c3,2025/1/17 0:00,其他,"You look cool, nice to meet you. Can we follow each other?",678607c5000000000803eb20,小红薯678E44BC,0,0,look cool nice meet follow,
678694cf00000000190358f6,6789bb58000000001b039511,2025/1/17 2:13,其他,,67880b39000000000801bfb7,tinahobbs,3,5,,
678794e4000000001601a50b,6789bbb3000000001b03aa51,2025/1/17 0:00,美国,TikTok refugee let's become mutuals,67871346000000000803f1f5,Khalifah,4,220,tiktok refugee let become mutuals,
67890d57000000001602144d,6789bf6c000000001b03a452,2025/1/17 2:24,美国,this would've done numbers on tt,6785b18d000000000801cec0,Anyely Garcia,11,0,done numbers tt,
6789c0200000000016018613,6789c1b50000000022009e96,2025/1/17 2:34,美国,I was a Hospice nurse  also. Now working LTAC. I loved being a hospice nurse.我也是一名临终关怀护士。现在在 LTAC 工作。我喜欢成为一名临终关怀护士。,6785c039000000000803ef24,Kwass1123,38,1509,hospice nurse working ltac loved hospice nurse ltac,
6789745e000000001801f592,6789c4a50000000022002412,2025/1/17 2:13,美国,you are really picking up...lol...sigma girl...,5edca70a000000000101faa9,Elan,1,1980,picking lol sigma girl,
6786189c000000000100a0c1,6789c8420000000022006986,2025/1/17 0:00,美国,This app is pretty cool,6785de73000000000801ffe1,Lupe_ortiz,2,1,app cool,
6788cbc000000000160369dc,6789ca02000000002101ab7a,2025/1/17 2:13,其他,"I English no good ,i like 太监 at 青楼 go shopping.",5ccadcec00000000100059c6,唯一的好姑娘,5,0,good go shopping,
6786d81b000000002100035e,6789ca98000000002200b8db,2025/1/17 2:13,美国,Can only Americans join this group?,6644e8fc00000000070054c0,Krystal,0,0,americans join group,
6789c5fb000000001900345a,6789ccc9000000001b038ef0,2025/1/17 0:00,其他,welcome,5816f9a650c4b46855341ced,祝我有座钻石山,1,3,welcome,
6784a97f0000000001000bf8,6789cec0000000002101f19a,2025/1/17 2:13,其他,"Your are not refugees, but villagers of the global village; it's not wandering, but finding a new home.follow?for follow",5edd9ccb0000000001004bca,Leon 廖,0,0,refugees villagers global village wandering finding new home follow follow,
67869c95000000000203cf81,6789cee7000000002103063a,2025/1/17 2:13,美国,great bag and great back??,5b6525760c8f5d0001e3793d,_pSi,0,2,great bag great,
6789c996000000001602c84d,6789cfb500000000210363b5,2025/1/17 2:13,美国,What!!! Even you're on red book now? I always see your videos on reels ,584fb92d82ec392944bd37cd,momo,8,21,red book see videos reels,
6789b4d700000000210002e7,6789cfe5000000001a038577,2025/1/17 0:00,其他,,5b588dea4eacab4beabd6f48,胡,1,7,,
67866555000000001703dd1f,6789d01b0000000022008654,2025/1/17 2:13,美国,thank you for the warm welcome   from Oklahoma USA,67898d85000000000a03e3e5,Elaine Dixon,0,0,thank warm welcome oklahoma usa,
678784650000000016036baf,6789d12d000000001a03c26f,2025/1/17 0:00,其他,hi，I am journal editor from Publishers.What can I do for you to publish your paper.Please leave me a message.,5ba6699a23d0e400018e323a,国际期刊编辑（Journal Editor）,0,5,hi journal editor publishers publish paper please leave message,
67875fc80000000021002f14,6789d541000000002003b506,2025/1/17 0:00,其他,gimme one,6789c422000000000e012d28,jordy,4,1,gim,
67875d99000000001c00d6c0,6789d6b3000000002103f9a0,2025/1/17 4:04,江苏,my cat,64171b720000000012012a18,啊吧啊吧,119,8,cat,
6786189c000000000100a0c1,6789d802000000001a03a247,2025/1/17 0:00,美国,I hope you're doing OK given the LA fires.   Stay safe.,67849024000000000803f5d9,AlexTheGr8,3,0,hope given la fires stay safe,
6786b5c2000000001703c806,6789d9c50000000022007483,2025/1/17 4:17,美国,Can i stay?,6789cd04000000000d008596,Ezequiel Gaspar,34,0,stay,
6788822c000000001d010005,6789da76000000002103c8bf,2025/1/17 0:00,其他,this is the highest interest rate I've ever seen.,5a7877f94eacab60addd5860,马甲别掉,23,0,highest interest rate seen,
6789d50e00000000160226ec,6789db990000000022003eb4,2025/1/17 0:00,其他,?????♀?问问:晚上走路是否安全？会真的接触毒品或者枪支吗？还有平时生活中都会给小费吗？Is your place safe at night? would you have access to guns or drugs? And tipping everything ?,64107f55000000001001dcb5,安清河,47,42,place safe night access guns drugs tipping everything,
6787b3290000000019030e04,6789dede000000001b031c3d,2025/1/17 0:00,其他,hi honey can you be my boyfriend,61f9ed19000000001000f09f,Giting,0,0,hi honey boyfriend,
678852f70000000019010fbb,6789e182000000001b0367f6,2025/1/17 5:00,其他,"hello, return the passport to me please",5f2a2a6a000000000100053a,作死学博士生,8,54,hello return passport please,
67863107000000000b0150f4,6789e62f0000000021034629,2025/1/17 0:00,其他,,67385362000000001c01ba75,123,4,4388,,
67879239000000001901965c,6789e68c000000002103ed79,2025/1/17 5:00,美国,So what we doing later,6785a201000000000803ecd3,Issy_a,0,180,,
6787d5210000000019002865,6789eb510000000021016f0a,2025/1/17 5:00,美国,"I don't own a cat :[, but I do own a dog!",6789d7a5000000000a03de06,Cavalettas,39,3,cat dog,
6786c0d0000000000b022fff,6789ebc100000000220015b8,2025/1/17 5:00,其他,Can I join?,6644e8fc00000000070054c0,Krystal,1,0,join,
6789c0200000000016018613,6789ed5300000000210155a2,2025/1/17 5:40,江西,"不用伤心。您的工作非常有意义，只有天使才能陪护并引导人们找到回家的路。Don't be sad. Your work is very meaningful, only angels can accompany and guide people to find their way home.",6786477d000000000803ccec,Rainbow,13,0,sad work meaningful angels accompany guide people find way home,
6787cf030000000019005a32,6789ed7a0000000021015e18,2025/1/17 5:41,美国,,6784e01b0000000008018548,CheesyUsername,6,2,,
6789e079000000000a006d99,6789edc5000000001b034f0b,2025/1/17 5:42,上海,put your top on ，take off your pants,5d221d3c000000001602dcbc,哈璣,90,100,put top take pants,
6789e079000000000a006d99,6789edc6000000002103ef42,2025/1/17 5:42,北京,Do you have a cat？,5657c6e49eb5780cdcd625c8,饼干不夹心儿,322,22,cat,
67867af70000000020029fa8,6789ee28000000002200c201,2025/1/17 5:44,安徽,请问有音乐软件可以听到这首歌吗？Is there a music program where I can hear the whole song?,5cfd2d09000000001602f06e,Dshuyi,2,748,music program hear whole song,
6786883e0000000020027049,6789f163000000001a03877b,2025/1/17 0:00,其他,this one for me,678739e8000000000801f624,小红薯6788831F,1,194,,
6789f12c000000001603e33e,6789f36300000000220010d9,2025/1/17 0:00,其他,may i have your WeChati want to practice my speaking oral English,5d2c923f000000001603908d,蒸烤箱,4,0,wechati want practice speaking oral english,
6788c50f0000000017001223,6789f3df0000000021017898,2025/1/17 6:08,美国,"Amy inspired me to start learning Mandarin a few months ago! I've loved her videos for years and watch them with my mom 
几个月前，在艾米的启发下，我开始学习普通话！ 我喜欢她的视频很多年了，还和妈妈一起看 ",67855b2a000000000801c957,Azrael,10,30,inspired start learning mandarin months loved videos years watch mom,
6789ef0c000000001c00d583,6789f423000000001a039274,2025/1/17 5:00,美国,please give me Chinese song recommendations ,65159335000000002401467e,JeffreyChang,19,2,please give chinese song recommendations,
6789f300000000001602d711,6789f4410000000020038ddf,2025/1/17 5:00,其他,good,5b4c062111be103a5cf94811,小红薯3FD11DD6,65,1,good,
6788c8a3000000001801dcd5,6789f631000000001a03ab97,2025/1/17 0:00,其他,beautiful ivy,5bee3f429d98130001b45f55,只只一,0,0,beautiful ivy,
678704aa000000001900660e,6789f8960000000022004230,2025/1/17 0:00,美国,If I could read this it would be pretty funny,67853b48000000000801eeb6,MrsStealYourDad,2,101,read pretty funny,
6785e86b000000000b030a68,6789fc2b000000002102fd81,2025/1/17 0:00,其他,,678610d000000000080189c0,Lanakia,1,1,,
6789d50e00000000160226ec,678a01f2000000002102c772,2025/1/17 0:00,美国,"In the United States, are children kicked out of the house after they turn 18?在美国，孩子18岁以后会被赶出家门吗？

",5af44bb3e8ac2b687145693b,momo,15,0,united states children kicked house turn,
6784f443000000000203ef6c,678a03320000000021014520,2025/1/17 7:46,其他,,5486ef0bd6e4a93d4c769952,喵??,1,2286,,
6785d56c000000001a035741,678a04ee000000002103e456,2025/1/17 0:00,其他,Can  you  help  me？,5fb000a8000000000100a7df,dream.瑶,9,2,help,
6787a43c000000001d010baf,678a0bdf000000001b037d45,2025/1/17 7:46,美国,毛 idk if thats cat in mandarin lol,6789c192000000000e010811,kate ?? ??,1,1,idk thats cat mandarin lol,
6788dfda0000000016022ab6,678a0ed7000000002003a12d,2025/1/17 0:00,其他,,5a90c45e4eacab12519aa31e,___拜拜雪公主??,0,5,,
67891354000000001801775f,678a0f15000000001b03e2a4,2025/1/17 7:46,美国,Music producer from LA! Just started working on Kpop! Loving your dance videos,67854c06000000000801fdaf,Mateo Barragan,8,2,music producer la started working kpop loving dance videos,
6786b5c2000000001703c806,678a0f51000000001a00d4ec,2025/1/17 8:05,美国,Can I get a chinese friend? ,67880ce0000000000801996e,Fatashio,45,5,get chinese friend,
6788e37b000000001d012205,678a12010000000022001fd8,2025/1/17 8:17,美国,YOU KNOW IT'S BAD WHEN TEXAS IS EVEN COMING TO REDNOTE,678441070000000008018f35,SkramzBop,252,1,know bad texas coming rednote,
6788dfda0000000016022ab6,678a121f000000002003b834,2025/1/17 0:00,其他,,5d3babb20000000011030072,Hmily,2,112,,
6789b4d700000000210002e7,678a1693000000002200f056,2025/1/17 0:00,其他,,5e3ff2730000000001001956,cute桃子i,1,1167,,
6789f300000000001602d711,678a16b4000000002200c0e8,2025/1/17 7:46,其他,very fantastic dance,5e4aea430000000001009d59,皓月之光,4,3652,fantastic dance,
67878c1a0000000018035e4e,678a17f9000000002200694b,2025/1/17 8:42,中国澳门,It's a weird way to propose but YES I do ,5d8ff5bc00000000010090ca,好心大学生收留offer,2,14,weird way propose yes,
6787fb4d000000001900470c,678a18c100000000210162ec,2025/1/17 0:00,美国,Are you straight,5a9c89514eacab6a1964863b,EllieOnTheRoad??,0,0,straight,
6786be5d000000000b00f29c,678a1958000000001b0320d3,2025/1/17 7:46,美国,CR7 is the best,5d083c83000000001100c9f2,Clair,0,1798,cr best,
67891354000000001801775f,678a1d54000000001a03b9fe,2025/1/17 7:46,美国,"嗨，朋友！你能告诉我我是否可以发布我拍摄的 飞碟 视频和图像吗？我已经在我的页面上分享了一个，但想确定这是允许的。谢谢！

Hi friend! Can you please tell me if it's ok for me to post UFO video and images that I take? I've shared one on my page already, but want to be certain it's allowed. Thank you!",67857734000000000700251e,InfinitelyEternal,19,28,hi friend please tell ok post ufo video images take shared page want certain allowed thank,
67868db3000000001800fd4e,678a1e5a000000001b031e27,2025/1/17 9:09,美国,请为非英语母语的人翻译“我们是他们家里的客人”。please translate for the non-English speakers We Are Guests in their home,67860cf7000000000801b90a,Rat mama (鼠妈妈),4,3,please translate non english speakers guests home,
678883180000000019032760,678a1e7f000000001b03e3b4,2025/1/17 0:00,其他,you are so beautiful！I want to make friends with you,6120889d00000000010068c1,补药开盒啊,0,1,beautiful want make friends,
67876ea20000000018035c62,678a1ed3000000002101dbef,2025/1/17 0:00,其他,Can i ?,673966a3000000001c018211,"BarryBiggs, 巴瑞",1,1,,
67875fc80000000021002f14,678a1fa5000000001b02c446,2025/1/17 0:00,美国,Where the hat from friend?,6785ddc9000000000801e02b,Workinondyin,3,8,friend,
6786d81b000000002100035e,678a1fbb000000002200bddb,2025/1/17 10:33,美国,Can Chinese join the group?,5e82ea4a000000000100bb9a,A.Z. WITH AI,0,25,chinese join group,
67872018000000001602240d,678a1fcc000000002200eb3f,2025/1/17 10:33,美国,I did NOT just watch a Chinese tutorial for sliding into DMs lmaoooo,678624ee000000000803ef6d,Mostafa Amr,4,0,watch chinese tutorial sliding dms lmaoooo,
