note_id,comment_id,create_time,ip_location_y,content,user_id_y,nickname_y,sub_comment_count,like_count_y,processed,label_h
678bd4d5000000001802fecf,678d6889000000001b031027,2025/1/19 21:03,美国,They took TikTok away from me way to early like at 10 when it wasn't even the 19th yet ??,678d3308000000000e0135d6,S4BAVIDS?,0,1,took way early th,
678c790a000000000a007add,678d6953000000000c01383f,2025/1/19 21:06,美国,we back tho,678d283d000000000d00974e,r4lRonn,0,15,tho,
6786c2bf000000000100a8c5,678d6b07000000001b02ec5a,2025/1/19 20:53,美国,Thank you! I am not from the USA but wanted to try this app!  Please follow me ,678d244c000000000e01003a,Glochavs,4,20,thank usa wanted try app please follow,
678a997a00000000160208dc,678d6cc5000000000c012143,2025/1/19 20:53,其他,,678d4aa3000000000a03cc54,Andrew Robinson,1,1838,,
6786412e00000000200263eb,678d6d2e000000000b038bf5,2025/1/19 21:22,广东,,6213d6c3000000001000c32b,john,0,2,,
678bde6b00000000210020b7,678d6d340000000020039801,2025/1/19 21:23,罗马尼亚,my cat,67870e12000000000801c6b0,Ella?,1,0,cat,
678c5d6a0000000016028e17,678d6e64000000001b030cae,2025/1/19 21:28,美国,I deleted it and can't get it back so I'm stuck on here,678c7483000000000e010b73,Liam,5,0,deleted get stuck,
6785ed85000000000b022756,678d6ee4000000000a035cba,2025/1/20 0:00,其他,"Hi! My dog, Maisy, says hello, too!",678d67bc000000000e01e854,小红薯678EC928,1,2,hi dog maisy says hello,
678c4214000000001802ba03,678d6f0e000000001b0313a7,2025/1/19 21:30,美国,placing this brick 1000%,678c7cc9000000000e01cf4f,br00k_lyyn,0,3,placing brick,
678bde6b00000000210020b7,678d707c000000002101d001,2025/1/19 21:37,美国,"Have to pay cat taxes.. Just wondering, if I don't have a cat, would sending pictures of someone else's cat be some sort of cat tax evasion...?",678641a2000000000801afd6,TiteRopeOfWeird,4,0,pay cat taxes wondering cat sending pictures someone cat sort cat tax evasion,
6787ae9600000000190005fe,678d70d6000000000b03b88a,2025/1/19 20:53,美国,"wait for me dear, UK isn't too far from here",6750e0d7000000001d02e3ac,LeafyLian,1,4,wait dear uk,
678bcc99000000001901284c,678d7129000000000b00b7f2,2025/1/19 21:39,美国,ouuuuu??,678c95dd000000000e01d060,Jada Flanagan,0,1,ouuuuu,
678bde6b00000000210020b7,678d71e1000000000a02cb0e,2025/1/19 21:42,美国,It stopped working yesterday but now it's back up for me!,67853ada000000000801c46b,Li Li (TikTok refugee),1,1,stopped working yesterday,
678d321900000000160234ac,678d71e7000000000c0120d0,2025/1/19 21:43,美国,What does it feel like to be safe outside at night? This is my dream. Hello my new friend,678ac061000000000e011a6a,CambriaCoast72,16,12,feel safe outside night dream hello new friend,
678bcc99000000001901284c,678d72a60000000009020eee,2025/1/19 21:46,美国,How to get TikTok back if you delete  it not on apps store,678a6ab8000000000e0137d1,Projectskillaa,0,4,get tiktok delete apps store,
678bde6b00000000210020b7,678d73a1000000001a00c4d9,2025/1/19 21:50,英国,This is cat approved,678d6c47000000000a03f3dc,Scooby,0,1,cat approved,
678beabd0000000016022a44,678d73ba000000001b0306ae,2025/1/19 21:50,美国,Moots anyone??????,678c69e3000000000e01c3e9,~ChoiSeungHyun~,0,38,moots anyone,
678d425e00000000160197be,678d7498000000000c013f1b,2025/1/20 0:00,美国,Idk whether I should stay now or,642f2ed70000000014011188,Wiktoiaaaaaa,438,0,idk stay,
678bcc99000000001901284c,678d7544000000001b031502,2025/1/19 21:57,美国,Follow 4 follow ifb fast,6788837d000000000803f8ac,glitterfartcool,1,1,follow follow ifb fast,
678d73d4000000001d012bdb,678d7570000000001b01e4a6,2025/1/19 21:58,美国,no fr when will we be able to reinstall,678c8969000000000a03eb86,Makala Vautour,161,431,fr able reinstall,
678bde6b00000000210020b7,678d78570000000021037906,2025/1/19 22:10,美国,my American cat,678c17a8000000000a03fa1b,小红薯678C426C,1,1,american cat,
678d73d4000000001d012bdb,678d7bfc000000001b037f56,2025/1/19 22:26,美国,I HOPE IT CAN LET ME INSTALL IT TOMORROW BECAUSE IM GONNA CRY SO MUCH,6785d0e3000000000803d947,Caseohfan :),27,1,hope let install tomorrow im gon cry,
678d73d4000000001d012bdb,678d7c4a000000001b02e8ac,2025/1/19 22:27,美国,not worth it it's now associated with Trump and in a very sketchy way,678d2e1f000000000a03e2ff,Smartty955,116,4614,worth associated trump sketchy way,
678bd4d5000000001802fecf,678d7cea000000000b0398b3,2025/1/19 22:30,德国,TikTok is back,67892b95000000000a03fcbf,qz.dq,0,3,tiktok,
678bb73400000000030219aa,678d7d71000000001b03501e,2025/1/19 23:40,其他,""" it's  ok but don't fuck me"" hahahahahaha",61b3be6700000000100075f7,Money,1,9972,ok fuck hahahahahaha,
678b70a00000000021003117,678d7e1c000000000a0352a7,2025/1/19 23:40,其他,come on,652fa2c7000000000200eb05,地道英语口语学习,0,502,come,
67860f020000000001008690,678d7fde000000002101c308,2025/1/19 23:40,美国,lol idk this one could get me in trouble,678c80f4000000000e013082,RedRover23,2,431,lol idk get trouble,
678d7ccb000000001c00cf8f,678d8107000000000b0395ad,2025/1/19 22:47,美国,TikTok has that "ICK" factor now! Staying on this app just a totally different wonderful vibe! ??,6785181d00000000080195e2,juliesammy11,26,1,tiktok ick factor staying app different wonderful vibe,
678c59ad0000000016023a27,678d81c9000000001b03464c,2025/1/19 23:40,其他,"yay I was right! Translation button is on, what will be next?",59ba080382ec3956980d2a1c,瑞雪Cloe,31,8,right translation button,
678c2f72000000001901c6ca,678d81cd0000000009022554,2025/1/19 22:50,美国,Am I the only one who knows tik tok is back,67871952000000000801e632,Oscar Matias,0,0,knows tik tok,
678c37dd000000001c00d567,678d8277000000000a03555d,2025/1/19 22:53,芬兰,I feel like TT will be some Trump channel in the future...,67879bb2000000000803cfd5,Janika,0,6,feel tt trump channel future,
678c20da000000000a00732a,678d8371000000002101e421,2025/1/19 22:57,美国,"REFUGEE FOLLOW TRAIN!!!!
1. Follow me (i follow back)
2. Follow everyone who comments under this
3. Make new friends",6785610d000000000801f586,Chevy M,0,1,refugee follow train follow follow follow everyone comments make new friends,
678ca5af000000001603f5c6,678d8404000000000b038dff,2025/1/19 23:00,菲律宾,ANYONE BE MY MOOT?,678c511f000000000e010e1d,esha.vebs,0,890,anyone moot,
67877a630000000016030bd3,678d84790000000020039009,2025/1/20 0:00,美国,"As a fellow American women i am sorry for my girlies they sometimes don't go outside and touch grass. 
GIRLIES BEHAVE!",678c25a8000000000e0127ab,Night Angel,2,0,fellow american women sorry girlies go outside touch grass girlies behave,
678bde6b00000000210020b7,678d85cd000000000c01065c,2025/1/19 23:07,美国,First one I followed after I deleted TikTok,678c3cc5000000000e01c0a6,小红薯678DAF3D,2,0,followed deleted tiktok,
67891ab90000000021002f45,678d871d000000000b00b989,2025/1/19 23:40,其他,@Marquise,678785cd000000000803fe6a,little kitten,5,178,marquise,
67874d860000000016019462,678d880c000000001b01fc9c,2025/1/19 23:17,智利,Ahora hay un botón de traducción! ??,67867e9d000000000803d2e0,Richard Thompson Inostroza,0,0,ahora hay un bot traducci,
678c790a000000000a007add,678d881600000000090225b7,2025/1/19 23:17,美国,EH WRONG ANSWER WE R SO BACK,6785b1b7000000000801a98b,Bored89,1,0,eh wrong answer,
678ca057000000001901829f,678d89400000000009020264,2025/1/19 23:22,美国,Moots anybody? I follow back!????,678c8569000000000e0111ca,gamblesgambit,0,3,moots anybody follow,
678ca057000000001901829f,678d89dc000000002102c298,2025/1/19 23:25,美国,"Moots!!! REFUGEE FOLLOW TRAIN!!!!
1. Follow me (i follow back????)
2. Follow everyone who comments under this
 #moots #American #tiktokrefugee",678ca3a0000000000e01f152,iiamFxndii,1,0,moots refugee follow train follow follow follow everyone comments moots american tiktokrefugee,
678c790a000000000a007add,678d8b9d000000002003b321,2025/1/19 23:32,美国,"Follow train from TikTok ban - U.S.  (literally emotionally burned out from this all but I'm here ??) let's grow each other 
",678d5268000000000e0131d1,George Victor,0,301,follow train tiktok ban burned let grow,
678d7dd4000000000a00556a,678d8d2c000000001a03af12,2025/1/19 23:39,美国,"Have you ever seen the movie ""The Thing?"" TikTok may look and act like TikTok, but it's real sus.",67852daf000000000801edbc,Snowman,37,0,seen movie thing tiktok look act tiktok real sus,
678d73d4000000001d012bdb,678d8db8000000000a02c14c,2025/1/19 23:41,美国,why would you delete it,678589a3000000000801c122,Effluxus,104,1,delete,
678c790a000000000a007add,678d8dc400000000090209de,2025/1/19 23:41,广东,TikTok回来了,5cbf2e5000000000160313d4,梦-,0,3,tiktok,
678b9d5f0000000017001901,678d8e5d0000000021037dd4,2025/1/19 23:40,美国,"Yes we are flirting, You are cute. We also like how kind you are and how friendly.",67856009000000000803c149,Eleanorreadsromantasy,0,567,flirting cute kind friendly,
678bcc99000000001901284c,678d8ea8000000000b039724,2025/1/19 23:45,尼日利亚,"REFUGEE FOLLOW TRAIN!!!!
1. Follow me (i follow back)
2. Follow everyone who comments under this
3. Make new friends
Any Nigerian here",678d3976000000000a03ccb1,So_phiyat,0,1,refugee follow train follow follow follow everyone comments make new friends nigerian,
67869ed40000000020028219,678d8f0700000000210154c9,2025/1/19 23:40,美国,Hahahah americans are hilarious i think i am probably the only croatian on this platform ??,678aac1e000000000e011eee,Rosanda panda,2,67,hahahah americans hilarious think croatian platform,
67874d860000000016019462,678d8f9900000000090205cc,2025/1/19 23:49,美国,I was told "If you love China so much why don't you marry it" 工人阶级英雄,6786488e000000000801ddc6,GUILLOTINE,0,2041,told love much marry,
678c37dd000000001c00d567,678d9003000000000902148e,2025/1/19 23:51,美国,My TikTok started working again. Kinda unexpected,678c78d4000000000e0107a0,Don Pancho,0,1194,tiktok started working kinda unexpected,
678c790a000000000a007add,678d9073000000001b039205,2025/1/19 23:53,美国,i didnt have time to save the mia khalifa bayonetta edit. im sick,6784f9b900000000080185a5,the25bam19 khun,0,7,didnt time save mia khalifa bayonetta edit im sick,
678ca057000000001901829f,678d908b000000000b03910f,2025/1/19 23:53,美国,Tik tok has been corrupted; im not going back! 抖音已被破壞；我不會回去！,675a7818000000001c0190b8,Ethan Black,0,23,tik tok corrupted im going,
678c82790000000016037f94,678d925a000000002003abf7,2025/1/20 0:01,美国,tiktok refugee gang! Let's follow each other! This is our chance to grow!,678bb701000000000e01d8d8,Maryam Rushdi_Trader1,0,0,tiktok refugee gang let follow chance grow,
678c82790000000016037f94,678d92cc000000002103101d,2025/1/20 0:03,美国,Moots? I follow back,678c7a11000000000e01d6fc,Photos0fjade,0,0,moots follow,
678ca5af000000001603f5c6,678d9473000000000b00a73d,2025/1/20 0:10,美国,Moots?,67873eef000000000801972e,Lowk.nicest,0,1,moots,
678ca057000000001901829f,678d94f90000000021014c10,2025/1/20 0:12,美国,On god,678baf77000000000a03cb57,Adan Gonzalez,0,128,god,
678ca057000000001901829f,678d950c000000000a0351b2,2025/1/20 0:13,尼日利亚,"I need moots ???? im nice i promise, idc where you're from",678d3976000000000a03ccb1,So_phiyat,0,0,need moots im nice promise idc,
678607c6000000000900f90d,678d9569000000002101daea,2025/1/19 23:40,美国,"Ladies, these men in China  I swear maybe this is why I've made it 35 and still single in the USA. My husband must be in China  I need to book a flight and stay for a while so he can find me ",67853b03000000000801d49f,Autumn Briar McKinney,10,0,ladies men china swear made single usa husband china book flight stay find,
678ca5af000000001603f5c6,678d959a000000000c013a51,2025/1/20 0:15,美国,My mom deleted it of my phone and now I can't get it back and it's gone ??,678597c0000000000803d2ab,Nana,1,102,mom deleted phone get gone,
678c82790000000016037f94,678d9646000000000a0349fa,2025/1/20 0:18,广东,Nice,6648b1a4000000000303286e,Yumi San,0,91,nice,
678bcc99000000001901284c,678d964e000000000c011a5c,2025/1/20 0:18,美国,Moots ifbb??????,6786db62000000000803fb19,M_Kaila17,0,0,moots ifbb,
678d7dd4000000000a00556a,678d967c000000000a03543a,2025/1/20 0:19,美国,Someone made the comment that TT is the friend in the zombie apocalypse that got bit but they're hiding it from the rest of the group,678aa2c3000000000e01c850,Genghis Flan,56,3,someone made comment tt friend zombie apocalypse got hiding rest group,
6787afff0000000019032a62,678d967c000000001b034e5f,2025/1/20 0:19,美国,"Hello, my friends in China, I' am Simba.",676647c2000000001801612a,Leo丶辛巴,1,72,hello friends china simba,
678c82790000000016037f94,678d96a7000000001a039b68,2025/1/20 0:19,美国,I uninstalled tik tok and I can't download it again,678ccea9000000000e0100e5,lidiu29,3,1,uninstalled tik tok download,
6787877e0000000019011f32,678d96cc000000000a036446,2025/1/19 23:40,其他,You are very pretty ,6784d1c50000000008018685,用户已注销,1,0,,
678c5d6a0000000016028e17,678d976d000000002102dd22,2025/1/20 0:23,美国,I'm so sad bru I deleted it now I can't get it ,678c7536000000000e012e65,小红薯678CF3CB,12,0,sad bru deleted get,
678d7dd4000000000a00556a,678d984a00000000210361a2,2025/1/20 0:26,美国,So we are all collectively agreeing to stay ????,678ae910000000000e0138ae,Baalbrig,23,2108,agreeing stay,
6786bd08000000001a01e438,678d985a0000000020038673,2025/1/20 0:27,加拿大,"oh hey, nice to find you again",678404cb000000000801a8af,espressodepresso,0,0,hey nice find,
678ca057000000001901829f,678d985e000000001a03a157,2025/1/20 0:27,美国,Moots anyone? Ifb quick,67868865000000000803f495,Shaina Adams,0,0,moots anyone ifb quick,
678ca057000000001901829f,678d986d000000000a02c232,2025/1/20 0:27,加拿大,Follow me if you're also a TikTok refugee ??I'll follow you back??,6785da2b000000000803e209,Fransheska,0,3,follow tiktok refugee follow,
678d425e00000000160197be,678d98b2000000001a03ad72,2025/1/20 0:00,美国,who cares it's better here ????,6786912b000000000801733c,LarBear,92,12,cares,
678cdca3000000001602f5a8,678d99520000000021016c6f,2025/1/20 0:31,美国,How I save,678d043c000000000a03c55e,Fartsandgiggles2063,0,2,save,
678b68cb00000000190034c6,678d9998000000000b00a2ca,2025/1/20 0:00,美国,"Hi hi, anyone want to be friends? I'm a 17 year old from New York^^",667e36360000000003032b8e,alexie,70,0,hi hi anyone want friends year old new york,
678c85e70000000003023b86,678d99bc000000001b02ca9e,2025/1/20 0:33,英国,If you wanna use TikTok in USA just get a vpn and change your location everything will be back to normal,678d41e6000000000e0117a9,Goodluck  Peter,0,1,wan use tiktok usa get vpn change location everything normal,
67890e890000000019006a66,678d99e500000000210347d6,2025/1/19 23:40,美国,That's why I'm just observing and learning,678d8127000000000e012ce6,Princess,5,730,observing learning,
6785ec46000000000b039627,678d9a06000000001b03c209,2025/1/20 0:34,河南,Morning handsome',6125be190000000001007bee,嘿！朋友,0,0,morning handsome,
6788882c00000000160229e0,678d9a47000000000b03aa24,2025/1/20 0:35,美国,Zeizei!,678afa8b000000000a03d1fc,STiTCHi Global (思迪奇全球),0,2,zeizei,
678d321900000000160234ac,678d9beb000000001b0300bc,2025/1/20 0:42,广东,What do you want to know about living in China as a woman? Leave me a comment here !  I will try to make more videos to y'all ,634bf045000000001802b43c,野外亚尼子YANI,30,14,want know living china woman leave comment try make videos,
678d7dd4000000000a00556a,678d9c2e000000001b034581,2025/1/20 0:43,美国,Yea I deleted it and can't redownload it... yea I'm cool on it,67854e19000000000801c1d9,Jalikth3rd,109,0,deleted redownload yea cool,
678c82790000000016037f94,678d9cbb000000001b035f6d,2025/1/20 0:45,马来西亚,It's back now ,678b9977000000000d00b113,rin,0,52,,
678c85e70000000003023b86,678d9d280000000021036e16,2025/1/20 0:47,美国,Follow me for follow back,678c819b000000000e01d867,CassyKing,0,0,follow follow,
678ca057000000001901829f,678d9d80000000001b0344e2,2025/1/20 0:49,美国,No! We love it here!,678740b400000000080198f8,lavsandre,0,0,love,
678c82790000000016037f94,678d9dc2000000000a02e270,2025/1/20 0:50,美国,,678c817c000000000e011de8,n?sfera,0,0,,
678ca057000000001901829f,678d9e02000000000a035f1b,2025/1/20 0:51,美国,Hey yall.. I'm new ,678d9d39000000000d008fdc,小红薯678E3366,0,199,hey new,
678ca057000000001901829f,678d9e8f000000002101df12,2025/1/20 0:53,厄瓜多尔,hahaha,67886307000000000803c74a,Francis Carrión,0,2,hahaha,
678c82790000000016037f94,678d9ebc0000000009023277,2025/1/20 0:54,美国,me last night ,6786a4fe000000000803c8db,hasanaamarie,0,0,last night,
6787d05e0000000019005f6e,678d9ecc000000000a034e34,2025/1/19 23:40,美国,Does 爸爸 or 妈妈 work ? Or is that only what foreigners say ? Asking for a friend ,676b7d30000000001801ecab,Kierra,2,2,work foreigners say asking friend,
678d425e00000000160197be,678d9edf0000000021014f09,2025/1/20 0:00,美国,"Who cares, the Cheeto demon can have it. I'm with my new friends now ",67850c2f000000000801b220,Icky_avocado,408,0,cares cheeto demon new friends,
678c790a000000000a007add,678d9f65000000000a037183,2025/1/20 0:57,美国,It's back but it's removed on the AppStore,67858ceb000000000803d509,Shelby Damron,1,7814,removed appstore,
678c8a590000000016023247,678da07500000000210146d6,2025/1/20 0:00,其他,tiktok好像恢复了,678d7ce1000000000e01049b,言,2,1,tiktok,
678d9fba0000000016021013,678da15e000000000a01adb0,2025/1/20 0:00,美国,"I want yo stay, but don't want to ruin it for Chinese or Chinese-American people. see my post for more details.     我想留下来，但不想破坏中国人或美籍华人的氛围。请参阅我的帖子了解更多详情。",6785fd06000000000801888a,Yani,2,543,want yo stay want ruin chinese chinese american people see post details,
678da0db000000000a00790b,678da21e000000000a019f46,2025/1/20 2:26,美国,Meitu has actually been my secret weapon in posting videos and selfies that I've been gate keeping for so long ?????? lol,678d15b3000000000e013d4c,Mechit117,3,3,meitu secret posting videos selfies gate keeping long lol,
678c82790000000016037f94,678da2f1000000002101f457,2025/1/20 1:12,乌克兰,,678cf9e5000000000d00a003,КуянСоня,0,146,,
678c674a0000000016021f8e,678da348000000000c0116b2,2025/1/20 0:00,其他,TT It's back now,66a6ecc6000000001b016a70,小红薯66A70D19,7,0,tt,
678ca057000000001901829f,678da3fc000000000b03aca3,2025/1/20 1:16,美国,"Just a heads up: 在中国课外补习英语是违法的! Private tutoring is illegal in China, so don't bother trying to teach English there!",5d8d41710000000001004a27,REST休息者,3,21,heads private tutoring illegal china trying teach english,
678c4214000000001802ba03,678da47a000000001b03742e,2025/1/20 1:18,美国,,678d2764000000000e012d38,Chris Cortes,0,1,,
678ca1810000000016022546,678da4c6000000000b009d59,2025/1/20 1:20,北京,fuck me now,647a7cb2000000002a035c72,momo,23,0,fuck,
6786bd08000000001a01e438,678da4fd000000000b00ab0c,2025/1/20 1:21,加拿大,yayyy I found you,678d8fe9000000000d008630,小红薯678E23B3,0,16,yayyy found,
678d424f000000001c00e3f0,678da5e5000000000b00a3d7,2025/1/20 1:24,广东,这是中国社区的app，请你们带上翻译友好交流This is the app of the Chinese community. Please bring the translator to communicate with us.,6361254e000000001f01ff3d,叫我滚去画画,64,2,app chinese community please bring translator communicate,
678c3be3000000001803129d,678da79a000000000c013c1b,2025/1/20 1:32,美国,Its way much easier to build FYP here,6788e946000000000803e2b6,Luna Alessandra,0,1,way easier build fyp,
678cdca3000000001602f5a8,678da7fb000000001b039fa6,2025/1/20 1:33,美国,,678c7a6c000000000d00a03e,chlo$,0,1,,
678ca057000000001901829f,678da8ef000000000c0118e6,2025/1/20 1:37,美国,Moots? I follow back ??,6786ad020000000008019950,Lil_baddie479,0,3,moots follow,
678c85e70000000003023b86,678da9030000000021016936,2025/1/20 1:38,美国,yahooo,6789bd06000000000d00a2d7,ndjdjdkf nsjskd,0,79,yahooo,
678ca057000000001901829f,678da97c000000001a03842c,2025/1/20 1:40,美国,Yessss,678c7fdd000000000e010faf,Dafurq.Phoebe,0,1,yessss,
678bf875000000001803e00d,678daaaa000000000a0375f7,2025/1/20 1:45,陕西,Can Tiktok know what's going on in my mindbro wtf is going on in your mind,6038953b0000000001001794,是这个国家,2,0,tiktok know going mindbro wtf going mind,
678c82790000000016037f94,678daabc000000001b01e05d,2025/1/20 1:45,美国,I keep searching up tt on the app store ????,6786f772000000000801ece1,Sngomii,0,2,keep searching tt app store,
678d87da000000001d010b2f,678dac48000000002003b7fe,2025/1/20 2:26,其他,"Not going back, may not stay here either. I don't fully trust anything here any more than I do back home. Such a strange time to be alive. It's a shame that so many bad actors have this much influence over us.",67875cc2000000000801d7fa,就在孟菲斯,141,7,going stay trust anything home strange time alive shame many bad actors much influence,
678c5d6a0000000016028e17,678dac990000000021037cb3,2025/1/20 1:53,美国,I SAW SOMEONE ON A COMMENT SAY THAT ITS BACK AND ITS GONNA BE BACK ON THE APP STORE TMRW (MONDAY) WITH A SCREENSHOT OF THE NOTIFICATION WHERE IT SAYS THAT THE BAN WAS CANCELEDD,6786f772000000000801ece1,Sngomii,2,133,saw someone comment say gon app store tmrw monday screenshot notification says ban canceledd,
678c82790000000016037f94,678dacaf000000000a034af3,2025/1/20 1:53,美国,Moots anyone??? Looking for new friends!!!,67892058000000000e013524,Rachel ??,0,0,moots anyone looking new friends,
678c82790000000016037f94,678dad02000000000b0391df,2025/1/20 1:55,美国,Follow me I follow back ??,6786ad020000000008019950,Lil_baddie479,0,97,follow follow,
678bfb50000000001803e511,678dad08000000000b03938b,2025/1/20 1:55,玻利维亚,Que hago aqui,678da6c7000000000a03ff69,小红薯678E6550,0,2,que hago aqui,
678c82790000000016037f94,678dae03000000000b039d45,2025/1/20 1:59,美国,moots anyone ..,6786f581000000000801fa54,64dcc,0,1,moots anyone,
678bf875000000001803e00d,678dae16000000001b0311d9,2025/1/20 1:59,美国,performative... but for whoo?,678c7bd2000000000d008497,CyrusGQ,0,0,performative whoo,
678bfb50000000001803e511,678dae2b000000001b03f699,2025/1/20 2:00,天津,i dont want cook，i want u,6776980000000000140339e2,Daisy,0,0,dont want cook want,
678c5d6a0000000016028e17,678daee5000000001b036e5b,2025/1/20 2:03,美国,people who deleted it??,6786bbfe000000000801a11b,Madeline Haigh,1,5,people deleted,
678d87da000000001d010b2f,678dafcb000000001b0384d3,2025/1/20 2:26,美国,"I'm not going back, going back, is like going back to an abusive relationship. I'm staying here in my healthy relationship and little red book.  ",678444d8000000000801b9e9,Hope_and_Yumi,193,0,going going going abusive relationship staying healthy relationship little red book,
678c82790000000016037f94,678db0000000000009020f32,2025/1/20 2:08,美国,Uh guys..?,67858f4f000000000801d1fc,Clovr_boi,0,0,uh guys,
678c5d6a0000000016028e17,678db00f000000001b02e174,2025/1/20 2:08,北京,What's going on?,6022f9730000000001004ddd,??.大嘿咪.??,1,0,going,
678bf875000000001803e00d,678db0220000000009021927,2025/1/20 2:08,美国,that actually happened,678af3fb000000000e012da3,phoenix_bird,0,3,happened,
678c5d6a0000000016028e17,678db07c0000000021031fd8,2025/1/20 2:10,美国,I like this app,6785bb5e00000000080181bb,Erin,1,1336,app,
678bf875000000001803e00d,678db108000000001b02c2f8,2025/1/20 2:12,美国,welp. now we're here. China yaa ,67849454000000000801eb1d,Sprunkle Spunk,0,0,welp china yaa,
678be03a000000001c00ec95,678db11b000000002101c576,2025/1/20 2:12,美国,,678590e3000000000801b03d,I like manatees ??,0,0,,
678bf875000000001803e00d,678db13500000000210194a7,2025/1/20 2:13,加拿大,It was a big f***** shou,67886c3e000000000803ef88,Starlordgaming,0,1,big shou,
678beabd0000000016022a44,678db19c000000001b01e77d,2025/1/20 2:14,英国,how u save audio,67881eca000000000801f9cb,CherryDrop,0,0,save audio,
678c20da000000000a00732a,678db1b3000000002101dc35,2025/1/20 2:15,美国,Skin looks AMAZING! Where can I get the products?,6785f6da000000000803ef68,KLeflore._,0,6,skin looks amazing get products,
678c068c0000000016031464,678db1d1000000001b030584,2025/1/20 2:15,美国,So now use newspaper,678dae1d000000000e01f549,小红薯678E779F,0,1,use newspaper,
678c82790000000016037f94,678db24e000000000b03969f,2025/1/20 2:17,美国,not the right choice of song gng ????,678c8bbb000000000e012b20,skiia,0,1,right choice song gng,
678c4214000000001802ba03,678db27c000000001b033686,2025/1/20 2:18,江苏,,5c4fece0000000001202b172,Yainox,0,0,,
6787cf030000000019005a32,678db35b000000002101dd2d,2025/1/20 2:22,美国,"as a flute player, I'm loving this",6785a79e000000000803cb6e,earth2vaeh,1,1,flute player loving,
678c9cab000000001601890d,678db3d0000000001b030d81,2025/1/20 2:24,美国,How do yall use the tiktok font and film sped up ,678d7112000000000e01c834,小红薯678E9727,0,1,yall use tiktok font film sped,
678c5d6a0000000016028e17,678db44c000000001b032c6b,2025/1/20 2:26,广西,"One day when I woke up, the sky collapsed and a distant relative secretly took a look at my sleep and quietly went back",6178c8ca0000000002021963,农大大,0,1,day woke sky collapsed distant relative took look sleep went,
678c82790000000016037f94,678db4c2000000000b009db6,2025/1/20 2:28,美国,THE VIDEO I LAST SAW ON TIKTOK HAD THIS SOUND ??,6789cac9000000000e010a6d,Leo Sancheese,0,2,video last saw tiktok sound,
67842492000000000b0333f5,678db571000000000a034487,2025/1/20 2:26,美国,moots?? i follow back! can't get tiktok back ,678c651b000000000a03deaa,678CE9D5,0,0,moots follow get tiktok,
678c790a000000000a007add,678db625000000002102c74d,2025/1/20 2:34,英国,Moots anyone follow me I follow everyone back instantly. asim.arfa on insta I follow back??,6786c4cc0000000008019e80,Arfa,0,4,moots anyone follow follow everyone asim arfa insta follow,
