note_id,comment_id,create_time,ip_location_y,content,user_id_y,nickname_y,sub_comment_count,like_count_y,processed,label_h
679669170000000029027714,679ac262000000000b009877,2025/1/30 1:20,其他,I'm here but shy. No one cared to follow me so I did get a bit discouraged. I took it as a sign that I'm not someone ppl may find interesting,67850bc0000000000803c372,小红薯678532EC,16,0,shy cared follow get bit discouraged took sign someone ppl find interesting,
679ac633000000002901b97b,679ac9450000000021016d25,2025/1/30 1:20,其他,WeChat,670e63a8000000001d03079e,??,1,0,,
679ac633000000002901b97b,679ac9b5000000001b0365b6,2025/1/30 1:20,美国,hi do you want to be friends,678badf6000000000e0122c6,Arthur,1,0,hi want friends,
679669170000000029027714,679acae9000000000a035966,2025/1/30 1:20,美国,We're here - it's just been a hard 9 days here in the US and we're all overwhelmed,6785594b000000000803eeb7,cocaworm,131,0,hard days overwhelmed,
678778b7000000001801f790,679acfe0000000001b02cecd,2025/1/30 1:20,美国,It's not used in a literal sense. It's meant as tongue in cheek. Do Chinese use sarcasm?,6789d5de000000000a03c14f,Angel nervik,1,0,used literal sense meant tongue cheek chinese use sarcasm,
678a737400000000160378ac,679ad5db000000000a0374cb,2025/1/30 1:20,其他,Hey let's be friends!!,678d07e7000000000e012996,miraaluvsuuu,1,60,hey let friends,
67882fb200000000160218ad,679ae718000000002101fbe2,2025/1/30 0:00,美国,cool fit. ??,67884166000000000801a449,Scorpio 1080,0,0,cool fit,
6789844d00000000160184f2,679afb68000000001b032bb3,2025/1/30 0:00,其他,Hi,678aa96a000000000e01c323,J2box,0,0,hi,
6789844d00000000160184f2,679afbb9000000001b03c3d9,2025/1/30 0:00,美国,Hi and thank u!,678aa96a000000000e01c323,J2box,0,6700,hi thank,
678e2670000000001800c4a2,679b0040000000002101ccb7,2025/1/30 4:06,其他,Why did you study in the US?,6793b28c000000000a03f3c9,小红薯679438E0,7,5,study,
679753b90000000029030109,679b01f3000000001b02c3b1,2025/1/30 4:06,其他,,586d91925e87e7502d3a71b4,花卜卜贝??,2,0,,
678de4c20000000019031ed9,679b0849000000000a035535,2025/1/30 4:06,美国,Happy New Year,678cfd4b000000000a03fb4d,Rajpatie Arledge,0,2,happy new year,
678a7b500000000021000f71,679b1c4b000000001b031d37,2025/1/30 6:53,美国,I am in love with ur personality  yaaasss biiitch ??,6785e29b000000000803e7ba,Leisel G. Munoz,0,0,love ur personality yaaasss biiitch,
678c59ad0000000016023a27,679b49b6000000001a038ca2,2025/1/30 9:40,美国,I'm staying I love it here  it's a beautiful positive place to stay in  it's beautiful,678f6c3f000000000e013e2c,Sasha Steel 6790B17B,0,10,staying love beautiful positive place stay beautiful,
6789f12c000000001603e33e,679b6ed7000000000c013a0f,2025/1/30 12:26,其他,Please help me.,679b6d97000000000e011f59,牛牛,5,3,please help,
679b4818000000001800d7e2,679b706f000000000b009925,2025/1/30 12:26,美国,"Due to popular demand, I cannot answer any more new conversations. I will if there is less demand. I sincerely apologize ",6787dc98000000000801dfc5,Kasper,15,0,due popular demand new conversations demand apologize,
6784d572000000001703b003,679b72a60000000021018346,2025/1/30 12:26,美国,HI!!! I'M NEW TO THIS APP ^^,679310e8000000000e01f18f,wlw,5,0,hi new app,
679ac633000000002901b97b,679b7a6b000000000a019f15,2025/1/30 12:26,其他,hii,6631dd020000000007006eeb,zyxw0n,0,8,hii,
6777d605000000000900f8ac,679b8563000000000a019793,2025/1/30 15:13,美国,"Oh that's not why we're looking for men in finance, sir...I'm not an accountant. I'm not even good with numbers- but, I'll do your taxes? ??",6784fbd60000000008018977,Aly Butts,0,2,looking men finance sir accountant good numbers taxes,
679669170000000029027714,679b8b2d000000000a0192fc,2025/1/30 15:13,美国,I dont post but I love scrolling on here! TikTok is for doom scrolling rednote is actually relaxing,678417ca000000000801fd18,Mikki Sweets,38,13,dont post scrolling tiktok doom scrolling rednote relaxing,
678c59ad0000000016023a27,679b8e3b000000000a01ae84,2025/1/30 15:13,美国,"I love this app so much. I find myself a bit rabid about protecting the peace here though     When I see other Americans that didn't come in the first couple waves being negative or rude, I get really upset because you have been so welcoming ",67865009000000000801ca68,BoogiePop Blues,0,1,love much find bit rabid protecting peace see americans come first couple waves negative rude get upset welcoming,
679b72cc000000002900fd94,679b9030000000000a037f57,2025/1/30 15:13,美国,"Good evening, my friend. You can go to Yunnan, Guizhou and Sichuan.",60056f1f0000000001001bb0,Ylike,27,0,good evening friend go guizhou sichuan,
6788822c000000001d010005,679badb3000000002101d9c7,2025/1/31 0:00,美国,What's your down payment?,6377a973000000001f01e2d0,Momo,5,1922,payment,
6788fc860000000018015c39,679bb3b9000000000b03bb61,2025/1/30 18:00,其他,,6791b587000000000e010364,又一个沮丧的美国人,2,77,,
67873e84000000001603d031,679bb6b0000000001b01d4e4,2025/1/30 18:00,美国,I'll follow you! Also trying to get follower now! ,6790c765000000000e01de5c,Jorge Zelàz,0,1,follow trying get follower,
6786ba5e000000002002d18b,679bbd13000000002102e029,2025/1/31 0:00,美国,I'm not a TikTok refugee but I thought it would be fun to post on here!,679b9a46000000000e01ffc8,Teagan Turner,1,16,tiktok refugee thought fun post,
678de4c20000000019031ed9,679bbd95000000001a03a18d,2025/1/30 18:00,其他,I'm not going anywhere sis. Tick tick is dead to me ,6785ccec000000000803cbcb,侯慧心,0,9,going sis tick tick dead,
6788fc860000000018015c39,679bc4ab000000000b00ab3c,2025/1/30 18:00,美国,I can't stop watching ,67884db5000000000803ffba,Katlin Sherrod,0,0,stop watching,
6786f309000000001803c144,679bc995000000000b03a237,2025/1/31 0:00,其他,Jingle boy and Belle. Excited to follow you.,67857219000000000803ffd0,小红薯678671F8,1,0,jingle boy belle excited follow,
6787a51800000000180304ff,679bd9df000000000a0372cc,2025/1/30 20:46,其他,Are you gay?,6787dcb30000000008018c94,dandre harris,7,3,gay,
67872018000000001602240d,679bf20900000000210148cd,2025/1/30 20:46,其他,Looking forward to your message,65f2a707000000000500cd3f,-,3,4,looking message,
6786f309000000001803c144,679bfe34000000001b03c67e,2025/1/31 0:00,美国,Hi! I'm Jenny from New York and I just followed you. I do not have cats but I do have dogs! Here is a pic of my babies.,6786b25e000000000803f294,Jennifer McCarthy,1,2702,hi jenny new york followed cats dogs pic babies,
678de4c20000000019031ed9,679c4361000000001a00f118,2025/1/31 2:20,美国,I'm never going back,678eb153000000000a03ef73,Earth Friend & Warrior,2,0,going,
6788fc860000000018015c39,679c483a000000001b033d87,2025/1/31 5:06,其他,,6785c00c000000000801f946,Raquel,1,7,,
6788fc860000000018015c39,679c4d5e0000000009022446,2025/1/31 5:06,其他,,6797071c000000000a03f32b,layla,0,0,,
679c59b2000000001902c576,679c59e9000000001a038e10,2025/1/31 0:00,美国,Tell me about yourself!???,679021f7000000000e01ffb2,Mahrukh Fraz,0,2,tell,
6786f309000000001803c144,679c5e8c000000000c011d75,2025/1/31 0:00,其他,Hello my name is Linda I live in Canada I love this platform I'm staying on here,678da0e1000000000d00b926,小红薯678E9467,0,1,hello name live canada love platform staying,
6777d605000000000900f8ac,679c64b7000000001a03a539,2025/1/31 5:06,美国,We are looking for the same thing.. should we.. get married?,6786ca71000000000803fa30,MeagTheTrashPanda,0,0,looking thing get married,
6777d605000000000900f8ac,679c69580000000021035ec3,2025/1/31 5:06,其他,"?????? Wait, you have taxes?!",678be8ad000000000e01f3d1,MommaRN,0,1,wait taxes,
6798d655000000002a00e041,679c6beb000000000c013439,2025/1/31 5:06,美国,we can be friends!! :>,67896333000000000601c1f9,Emily ×,2,25,friends,
679c59b2000000001902c576,679c6f5a000000001b034424,2025/1/31 0:00,其他,Nice to meet you. Welcome to China!,626d1c3a000000001501b65a,小陈的日常~,2,6,nice meet welcome china,
6788fc860000000018015c39,679c6fb8000000000a0183ba,2025/1/31 7:53,其他,,6789973e000000000a03c593,小红薯678AA578,0,2,,
679c59b2000000001902c576,679c7ad6000000001a00f072,2025/1/31 0:00,其他,Hi,66eab942000000001d023c41,yb,2,2,hi,
679c7e590000000029017aea,679c7f4f0000000021017eaf,2025/1/31 7:53,其他,Maybe we can be friends.,65c4a2b00000000011017d81,Cathy林撄許,2,4,friends,
679c7e590000000029017aea,679c808f0000000021032848,2025/1/31 7:53,其他,Hi！,608b47d1000000000101c79b,懒觉羊,3,3,hi,
679c59b2000000001902c576,679c837f000000001b03a510,2025/1/31 0:00,其他,lmao。,5fddbdc4000000000100351d,木鱼飞航设计,1,3,lmao,
679c7e590000000029017aea,679caafc000000000a036699,2025/1/31 10:40,其他,hello,5ac8dcd34eacab7e0608f6f7,凉木礼,2,1,hello,
679c7e590000000029017aea,679caf33000000000b008d8f,2025/1/31 10:40,其他,"Hello, I'm from China, can we be friends?",64354a19000000000e01cb34,小红薯643697AF,1,1,hello china friends,
6792e56b0000000029038e49,679cb18a000000000b00b602,2025/1/31 10:40,其他,"嗨~ 新朋友~你好~ 很高兴认识你！ ，我们是一支很小众的中国乐队~ 如果你喜欢音乐~欢迎你来我主页听我们乐队的音乐，希望你在小红书玩得开心~ （Hi！New friend！Nice to meet u！，We are a China band with a small audience ，if u like music，u are especially welcome to my home page to listen to my music, i  hope you have a good time in rednote.！~）",5bb2fa16e617cb000143cfe1,无共识乐队,0,0,hi new friend nice meet china band small audience music welcome home page listen music hope good time rednote,
67856c340000000001003c74,679ccb77000000000b03b391,2025/1/31 13:26,美国,holy moly now that's beauty,678c78f7000000000e011987,Ace7773,2,1,holy moly beauty,
679cda750000000017039dcd,679cdce8000000001b039d32,2025/1/31 13:26,美国,can we follow each other? thank you,6787d814000000000801ec13,YMXina,2,1,follow thank,
679cda750000000017039dcd,679cdf79000000000b00bca5,2025/1/31 13:26,美国,I'm looking for people around ages 15-18??. I'm still a teenager so I don't feel comfortable talking to people who are way older,6656f60f0000000003033ca1,Shannen,0,1,looking people ages teenager feel comfortable talking people way,
6788822c000000001d010005,679ce476000000001b031ab4,2025/1/31 0:00,美国,"When I was in NYC, my rent was $4600 per month. Maybe that's a NYC thing.",5b7fb4c626cd5c000179ddfb,zzz,5,1,nyc rent month nyc thing,
6786ba5e000000002002d18b,679ce548000000001b030c8a,2025/1/31 0:00,美国,Here's my cat tax,679c1e81000000000a03e887,??Alaina??,1,10,cat tax,
679cda750000000017039dcd,679ce807000000001b039ebc,2025/1/31 16:13,其他,Guten Tag,6532a4f0000000002a01815f,Tao,3,2,guten tag,
679cda750000000017039dcd,679cee47000000000b03bfe0,2025/1/31 16:13,其他,Ur so pretty ???? bmf??,67851d080000000008018ab3,localx,1,7,ur bmf,
6790f142000000001703b596,679cfbab000000001b034e1b,2025/1/31 16:13,其他,"Wenn du in Deutschland Brot isst, wirst du niemals aufh?ren, aber eines Tages wird der Topf aufh?ren.。",5c63803b0000000012003596,青黛半夏,1,2,wenn du deutschland brot isst du niemals aufh ren aber eines tages wird der topf aufh ren,
679cda750000000017039dcd,679d19b0000000000a034db2,2025/1/31 19:00,其他,I am a high school student.hi!,61f8e06700000000210258f4,小泡椒,3,1,high school student hi,
6798d655000000002a00e041,679d51d2000000000b03a3ea,2025/1/31 21:46,美国,"hiii friends~!!  I speak English, Spanish, and I'm learning Chinese~!  let's be friends !!",6787ce92000000000803ed85,yayaxin,0,2,hiii friends speak english spanish learning chinese let friends,
679c59b2000000001902c576,679d8ac0000000000a01ab84,2025/2/1 0:00,美国,Happy New Year. You are so beautiful.????,59eb31dfe8ac2b3b97ee528d,DuuL,2,1,happy new year beautiful,
678f7453000000001800d4f2,679d9764000000000b03b1a1,2025/2/1 3:20,其他,,65c8cca9000000000b03af76,leve！,3,2,,
678a52d4000000000a004d0a,679da0c6000000000b03915d,2025/2/1 3:20,美国,Bro I've known all this and it's surprising the brief tiktok ban made America realize that the people in China are so nice. Literally the nicest people I've met this year are from china. and mandarin is such a beautiful language,6786d78a00000000080180a4,Javier samora,2,56,bro known surprising brief tiktok ban made america realize people china nice nicest people met year china mandarin beautiful language,
67944565000000001902d85a,679da6490000000009021c1a,2025/2/1 3:20,其他,You are a fairy,5baa4e94bbabda0001582d49,Ayaki,0,2,fairy,
67944565000000001902d85a,679dae35000000001b03757b,2025/2/1 6:06,其他,so pretty girl ,566ffcc6589de369c3e8c7ce,顿感momo,0,5,girl,
67944565000000001902d85a,679db273000000001b03c3f9,2025/2/1 6:06,其他,yes yes！,679465b3000000000e01ee01,水母予森,0,23,yes,
67882de0000000001d01284a,679db401000000001b0398d6,2025/2/1 6:06,美国,Can we be friends? ,6785dfb9000000000801a8fa,Sofizii,0,13,friends,
6798d655000000002a00e041,679dbdba000000000c013c73,2025/2/1 6:06,其他,Mee,63cd142200000000260124fb,【1 亻姄姄者^_^】,0,112,mee,
6789c5fb000000001900345a,679dc94800000000210375cb,2025/2/1 0:00,其他,Hello! I'm a Chinese student. Pleased to meet you! How old are you? I really hope we can become friends!,5bde4ffcf86c140001ea683f,柇荟,1,0,hello chinese student pleased meet old hope become friends,
678edd7d000000001703b7f4,679dcf9b000000001b02d3af,2025/2/1 0:00,美国,"Girl, your English is fantastic. You're doing so well.",67860b7a000000000801efca,Debi Clough,1,219,girl english fantastic well,
6784d572000000001703b003,679dd6b9000000000a034b7a,2025/2/1 8:53,美国,"Hello Girlies, I'm an Indian girl, anyone wanna be friends?",678859ca000000000803e12a,Paakhi,4,9,hello girlies indian girl anyone wan friends,
6788c7d3000000001b00818d,679ddf2f000000001b03a9a8,2025/2/1 0:00,其他,l love you,5ef6101d000000000101ca18,Uuuuu33,6,3232,love,
678a6552000000001900316e,679e2cae000000000b00a269,2025/2/1 14:26,其他,Can you become my boyfriend?,66cb4138000000001d023714,小红薯66CBC424,1,1,become boyfriend,
6777d605000000000900f8ac,679e3e83000000000a018910,2025/2/1 14:26,美国,"No, that was funny!!",678dbf13000000000a03cb1e,Carrie Garay Quirantes,0,1,funny,
67872018000000001602240d,679ea502000000001b03c83f,2025/2/1 22:46,美国,Hope for a rednote boyfriend,678c7fa8000000000e013cd0,freddy-piedr1t4,1,1,hope rednote boyfriend,
6784d572000000001703b003,679eab5e000000000c013501,2025/2/1 22:46,美国,Hi! Happy to chat with adults who'd like to practice English -- it was my favourite subject in school ,678861960000000008018cdf,David,3,4,hi happy adults practice english favourite subject school,
67872018000000001602240d,679ecd76000000000a02dcc7,2025/2/2 1:33,其他,WLW WHERE ARE YOU ????,678af2b3000000000a03f638,VEN,3,3,wlw,
678c59ad0000000016023a27,679ecf78000000001b034201,2025/2/2 1:33,其他,"Great now I'm crying, this was beautifully said ",6787caf5000000000801f402,Felicia Nicole 菲莉西亚 尼科尔,0,0,great crying said,
679669170000000029027714,679ed344000000001b02d7fc,2025/2/2 1:33,其他,"We're here, it's just been a lot going on in the USA.
我們在這裡，只是美國發生了很多事。",6787310e000000000801ee0b,關於雷的一切,13,5,lot going usa,
6787ae9600000000190005fe,679edec8000000000a01bb4c,2025/2/2 1:33,美国,@Roundround 结婚,5b1bd43ee8ac2b0c0132808f,heIiic,1,5,roundround,
6777d605000000000900f8ac,679ee3b2000000000a01b500,2025/2/2 4:20,美国,"I'm looking for a man in finance, 98. Bad health, no living relatives.",678c8fab000000000e01eae4,Marleyasinbob,2,11,looking man finance bad health living relatives,
678de4c20000000019031ed9,679ee84f000000000a02e812,2025/2/2 4:20,美国,We aren't going back. It's nice here,67857d1a000000000801a918,BritneyB_MFT,3,3,going nice,
678726970000000016033257,679ee8dc000000000a019c91,2025/2/2 4:20,其他,,6786488d000000000803e4fe,Zal,0,223,,
679ef69f000000001800e43b,679ef713000000001a00efca,2025/2/2 4:20,美国,I'll be your friend!,67860a5f000000000801d9eb,Grace Goodstein,1,0,friend,
679ef69f000000001800e43b,679ef803000000001b03a027,2025/2/2 4:20,美国,"Me too, but I'd be happy to be your friend ",6787f524000000000801e668,KigTheFig,1,20,happy friend,
679ef69f000000001800e43b,679efa2f0000000009023b23,2025/2/2 4:20,美国,I'll be your friend ,676ce0570000000018014227,Jade,1,15,friend,
678c934900000000190183ab,679eff07000000001a00ccd7,2025/2/2 4:20,其他,So beautiful.,5eed7608000000000101e5be,芊芊,1,4,beautiful,
679669170000000029027714,679f1400000000002103670d,2025/2/2 0:00,美国,Still stopping in for a scroll every once in a while,678c30dc000000000e01c092,Haley Grubbs,1,2,stopping scroll,
678b68cb00000000190034c6,679f1a56000000002102f79f,2025/2/2 0:00,其他,I want make friends here,657043ad0000000020031c49,怡不定,3,1,want make friends,
67856c340000000001003c74,679f58cf000000001b03871f,2025/2/2 12:40,其他,What a beauty.you're gorgeous.love you,678971b5000000000a03f727,杨义,3,41,beauty gorgeous love,
6786e73b000000001b00a1a8,679f803a000000002101fe18,2025/2/2 15:26,其他,I'm in.,63f60ad4000000000f010ddf,尤尤里,1,0,,
6784d572000000001703b003,679f95e2000000001b036ac4,2025/2/2 15:26,美国,I'm 14 turning 15 this month. anyone wanna be my friendddd? someone who won't ghost,678c99a7000000000e01f760,Rynn,2,1,turning month anyone wan friendddd someone ghost,
679f93f6000000002602dd32,679f9939000000002101c6d1,2025/2/3 0:00,美国,why is it forbidden ?,6789f778000000000e01de6e,Everett Tingley,7,3,forbidden,
678f90de0000000018008df5,679fa0da000000000902377c,2025/2/3 0:00,其他,gorgeous girl,646b4a37000000002a009a29,momo,0,0,gorgeous girl,
6789932b000000001801cded,679fa2ad000000001b036295,2025/2/2 18:13,其他,Let's be friends!!,6784ed15000000000801c76b,_Ifwtd_,1,1,let friends,
6786ba5e000000002002d18b,679fcc90000000000b039ecf,2025/2/3 0:00,其他,,67872962000000000803ff30,Dil Terri,1,1,,
678778b7000000001801f790,679fdd190000000009022045,2025/2/2 21:00,美国,"actually, we came here looking for an outlet,, and found out the term tik tok refugee actually came from people here, that was calling us that, we didn't start it.",678cddae000000000a03ca68,Gothaffirmation,0,0,came looking outlet found term tik tok refugee came people calling start,
679f93f6000000002602dd32,67a0242d00000000210358b0,2025/2/3 0:00,美国,Now that I know of a specific place on the planet where I'm not allowed to go... I desperately want to go!,678bddf7000000000a03e73a,Nell-Tea Across Eras Pod,6,0,know specific place planet allowed go want go,
678775f9000000001602ddb8,67a05973000000000c011105,2025/2/3 5:20,美国,"Hello, my long-lost husband",5f13fd9c000000000101c1b0,Avna,64,6,hello lost husband,
679c7e590000000029017aea,67a065d8000000000b00a9f6,2025/2/3 8:06,其他,omgggg i love link click !!,67a046e5000000000d0080ea,Claire,2,2,omgggg love link click,
678a7b500000000021000f71,67a0802a000000000902278f,2025/2/3 8:06,美国,She's so cute and funny ,677a6384000000001801698a,Gnarcissist,1,31,cute funny,
6785789c0000000001000b37,67a08b4f00000000180254f8,2025/2/3 0:00,其他,May I ask are you interested in English teaching job in China?,65e40f3c000000000500fcec,外教推荐-广州乐云咨询,0,20,ask interested english teaching job china,
678edd7d000000001703b7f4,67a08bf40000000021034930,2025/2/3 0:00,美国,oh trust me I'm not going anywhere I love this app! ???,6785bbf8000000000803e17b,Autumn,1,0,oh trust going love app,
678778b7000000001801f790,67a0f5d5000000000a02d823,2025/2/3 16:26,美国,This is what everyone has been calling us since we got here. We didn't start this.,6787af88000000000801b0f2,Wickedcrafty1,1,0,everyone calling got start,
678c778e000000001802dc17,67a0ff99000000000c010ab0,2025/2/4 0:00,其他,Nice to meet you.,5dac00bd000000000100bfc6,啃锅贴的v型韭菜脸,0,0,nice meet,
679fbee1000000001703bbb2,67a1161c000000000a019a5e,2025/2/3 19:13,其他,yes yes plz,5c7db6130000000012005f64,小+1,14,0,yes plz,
678ed8710000000029014d79,67a147a8000000002101ff12,2025/2/3 22:00,其他,I'm staying :D everyone is so sweet here!! And I love seeing others pets and new foods to try !!,6799daac000000000e01c78f,小红薯679B5B91,1,5,staying everyone sweet love seeing others pets new foods try,
678c6d3b00000000160211cd,67a16b3e000000001a00e341,2025/2/4 0:46,美国,"In MN. My kidney stone with surgeries was closer to $90,000 USD.",678e9ea4000000000d00a7c0,XHS_Jen_Here,6,17,mn kidney stone surgeries usd,
679f93f6000000002602dd32,67a18eb0000000000a02f47f,2025/2/4 0:00,其他,"In China there are many places prohibited to foreigners, not just this place, like 西沙群岛 for example. I really don't understand why they do this... 
This just happens in China...",61a78508000000001000de54,炎朱力 Julio C Kattah,7,3,many places prohibited foreigners place example understand happens china,
678f90de0000000018008df5,67a191ab000000001b01d4ce,2025/2/4 0:00,其他,r,5cf52e540000000016029172,展览策划与设计婷姐,0,0,,
67a102b40000000029018c9b,67a1977b000000002003b0f5,2025/2/4 0:00,美国,How tall are you？,619ceb0d000000001000c8c5,Hyeii,6,6,tall,
67a1be55000000002803c2e8,67a1bea1000000001b03eea4,2025/2/4 6:20,其他,,664a37ae00000000070076b0,鱼子酱,0,174,,
67a1be55000000002803c2e8,67a1bf2b000000000b00b383,2025/2/4 6:20,美国,Who's your favorite musician,639ebd5d000000002702b722,X,1,0,favorite musician,
67872b050000000018030c50,67a1dc60000000000b038091,2025/2/4 9:06,其他,You look like Thanos!,67a1d9f4000000000e010a9a,AK,8,1,look thanos,
67a1be55000000002803c2e8,67a1df6a000000000c0104f9,2025/2/4 9:06,其他,"WelcomeBy the way, I've made some videos for you guys to learn  Mandarin. Hope they are helpful. Please follow me. Thank you .（ If you are not interested in Mandarin, sorry to bother you)",5af692836b58b730d4e1368e,光谷袁袁Chinese_teacher,0,2,welcomeby way made videos guys learn mandarin hope helpful please follow thank interested mandarin sorry bother,
67a1be55000000002803c2e8,67a1efb8000000000a01b67a,2025/2/4 11:53,其他,,60c17c6b000000000101f082,我向八尺捐汽油,0,2,,
6787d5210000000019002865,67a2109e00000000200387f3,2025/2/4 11:53,其他,"hii my name is kira, i recently joined and heres one of my cats!",67a14ef6000000000e01ee85,小红薯67A22BCD,1,1,hii name kira joined heres cats,
67a1be55000000002803c2e8,67a214bd000000000a019b45,2025/2/4 14:40,美国,your Chinese name is very good,645658fd000000002a008da8,Austin,0,49,chinese name good,
6788c7d3000000001b00818d,67a2231d000000000b03a057,2025/2/4 0:00,其他,Are you a,63ae865c0000000027029920,悟,3,0,,
67a102b40000000029018c9b,67a23af500000000210148cb,2025/2/5 0:00,其他,how old are you,61a3434e0000000010005b2f,喜欢马里奥和三喜,4,1,old,
67a102b40000000029018c9b,67a23be9000000001b01c69b,2025/2/5 0:00,其他,Do you think you're handsome？,61a3434e0000000010005b2f,喜欢马里奥和三喜,6,100,think handsome,
67a102b40000000029018c9b,67a23fd2000000001b03b19e,2025/2/5 0:00,其他,"you are from Netherlands, you must be very tall!",545245fad6e4a90ae750aed0,Juicy喵,4,3,netherlands tall,
67a102b40000000029018c9b,67a2476100000000210307d9,2025/2/5 0:00,其他,Your cat is very cute.,5d3c49f7000000001603f209,爆炸??盐,3,2,cat cute,
67880c1c000000001803369c,67a24c1f000000001b035df9,2025/2/4 17:26,美国,Can u help us to beat the Korean plz,5c4c1bcf000000001103c660,Kevin.Yuppirates,1,0,help beat korean plz,
6789c5fb000000001900345a,67a25755000000001b030546,2025/2/5 0:00,美国,Hello! I'm a Chinese student. Pleased to meet you! How old are you? I really hope we can become friends!,5c97eafa00000000100057b7,SauceGotdriP_,3,2,hello chinese student pleased meet old hope become friends,
6787b3290000000019030e04,67a265e4000000001b032135,2025/2/5 0:00,其他,"So handsome, doesn't anyone care?",5ed3a26d0000000001005958,奈奈,0,1,handsome anyone care,
6798d655000000002a00e041,67a267fe000000000a01abed,2025/2/4 20:13,美国,does anyone want an Egyptian friend?,67882b28000000000801a3ab,Abdelrahman A,1,3,anyone want egyptian friend,
6785789c0000000001000b37,67a2c46c0000000021031b36,2025/2/5 0:00,其他,Hello！Can you help me to finish my homework？,5eabd2d30000000001007a9a,7^,0,0,hello help finish homework,
678c9410000000001c00c1ab,67a2d037000000000a037e1d,2025/2/5 0:00,其他,"Indonesian lady, really beautiful，from Chinese love",627fc879000000002102adba,逸梦,0,0,indonesian lady beautiful chinese love,
678c9410000000001c00c1ab,67a2d78f000000000c011b7e,2025/2/5 0:00,其他,really beautiful,627fc879000000002102adba,逸梦,0,3,beautiful,
6786e73b000000001b00a1a8,67a2f0e6000000001402d334,2025/2/5 4:33,美国,We can help each other,5c95d3b0000000001100101c,Sally,1,0,help,
6787b3290000000019030e04,67a2f9c50000000009020416,2025/2/5 0:00,其他,"I want a foreign boyfriend. The homepage video is about me. If you like it, you can send me a private message",6383667f000000001f01beb5,爱舔酸奶盖??（看??耶）,0,0,want foreign boyfriend homepage video send private message,
678a7b500000000021000f71,67a31104000000000a036771,2025/2/5 7:20,美国,She said and the body tea,6783323a000000000801da5f,Bethany_ac,0,0,said body tea,
679fbee1000000001703bbb2,67a33980000000000a02fc4f,2025/2/5 10:06,其他,,6785597f00000000080192df,Kadesha R,1,0,,
678dd7d3000000001d012a12,67a354ba0000000020039570,2025/2/5 12:53,其他,Haiiiii,60ed4d0e0000000001002a11,Shirleyyy??,0,8,haiiiii,
6790a2f2000000001800f58a,67a37837000000000a02ebc3,2025/2/5 15:40,其他,I want to be your friend,6109f3e3000000000101d895,卿落如棠,1,2,want friend,
678c6d3b00000000160211cd,67a37fe2000000001b01fbe2,2025/2/5 15:40,美国,"??I am Italian, and here I’ve always heard that in China you don’t pay the doctor in advance, but only afterwards and only if they’ve managed to solve your problem. Is this true?",67877df0000000000801dfd7,MrsElisabeth,11,0,italian heard china pay doctor advance afterwards managed solve problem true,
